{
  "name": "Inventory Ad Hoc Commands List",
  "description": "# List Ad Hoc Commands for an Inventory:\n\nMake a GET request to this resource to retrieve a list of\nad hoc commands associated with the selected\ninventory.\n\nThe resulting data structure contains:\n\n    {\n        \"count\": 99,\n        \"next\": null,\n        \"previous\": null,\n        \"results\": [\n            ...\n        ]\n    }\n\nThe `count` field indicates the total number of ad hoc commands\nfound for the given query.  The `next` and `previous` fields provides links to\nadditional results if there are more than will fit on a single page.  The\n`results` list contains zero or more ad hoc command records.  \n\n## Results\n\nEach ad hoc command data structure includes the following fields:\n\n* `id`: Database ID for this ad hoc command. (integer)\n* `type`: Data type for this ad hoc command. (choice)\n* `url`: URL for this ad hoc command. (string)\n* `related`: Data structure with URLs of related resources. (object)\n* `summary_fields`: Data structure with name/description for related resources.  The output for some objects may be limited for performance reasons. (object)\n* `created`: Timestamp when this ad hoc command was created. (datetime)\n* `modified`: Timestamp when this ad hoc command was last modified. (datetime)\n* `name`: Name of this ad hoc command. (string)\n* `launch_type`:  (choice)\n    - `manual`: Manual\n    - `relaunch`: Relaunch\n    - `callback`: Callback\n    - `scheduled`: Scheduled\n    - `dependency`: Dependency\n    - `workflow`: Workflow\n    - `webhook`: Webhook\n    - `sync`: Sync\n    - `scm`: SCM Update\n* `status`:  (choice)\n    - `new`: New\n    - `pending`: Pending\n    - `waiting`: Waiting\n    - `running`: Running\n    - `successful`: Successful\n    - `failed`: Failed\n    - `error`: Error\n    - `canceled`: Canceled\n* `execution_environment`: The container image to be used for execution. (id)\n* `failed`:  (boolean)\n* `started`: The date and time the job was queued for starting. (datetime)\n* `finished`: The date and time the job finished execution. (datetime)\n* `canceled_on`: The date and time when the cancel request was sent. (datetime)\n* `elapsed`: Elapsed time in seconds that the job ran. (decimal)\n* `job_explanation`: A status field to indicate the state of the job if it wasn&#x27;t able to run and capture stdout (string)\n* `execution_node`: The node the job executed on. (string)\n* `controller_node`: The instance that managed the execution environment. (string)\n* `launched_by`:  (field)\n* `work_unit_id`: The Receptor work unit ID associated with this job. (string)\n* `job_type`:  (choice)\n    - `run`: Run\n    - `check`: Check\n* `inventory`:  (id)\n* `limit`:  (string)\n* `credential`:  (id)\n* `module_name`:  (choice)\n    - `command`\n    - `shell`\n    - `yum`\n    - `apt`\n    - `apt_key`\n    - `apt_repository`\n    - `apt_rpm`\n    - `service`\n    - `group`\n    - `user`\n    - `mount`\n    - `ping`\n    - `selinux`\n    - `setup`\n    - `win_ping`\n    - `win_service`\n    - `win_updates`\n    - `win_group`\n    - `win_user`\n* `module_args`:  (string)\n* `forks`:  (integer)\n* `verbosity`:  (choice)\n    - `0`: 0 (Normal)\n    - `1`: 1 (Verbose)\n    - `2`: 2 (More Verbose)\n    - `3`: 3 (Debug)\n    - `4`: 4 (Connection Debug)\n    - `5`: 5 (WinRM Debug)\n* `extra_vars`:  (string)\n* `become_enabled`:  (boolean)\n* `diff_mode`:  (boolean)\n\n\n\n## Sorting\n\nTo specify that ad hoc commands are returned in a particular\norder, use the `order_by` query string parameter on the GET request.\n\n    ?order_by=name\n\nPrefix the field name with a dash `-` to sort in reverse:\n\n    ?order_by=-name\n\nMultiple sorting fields may be specified by separating the field names with a\ncomma `,`:\n\n    ?order_by=name,some_other_field\n\n## Pagination\n\nUse the `page_size` query string parameter to change the number of results\nreturned for each request.  Use the `page` query string parameter to retrieve\na particular page of results.\n\n    ?page_size=100&page=2\n\nThe `previous` and `next` links returned with the results will set these query\nstring parameters automatically.\n\n## Searching\n\nUse the `search` query string parameter to perform a case-insensitive search\nwithin all designated text fields of a model.\n\n    ?search=findme\n\n(_Added in Ansible Tower 3.1.0_) Search across related fields:\n\n    ?related__search=findme\n\nNote: If you want to provide more than one search term, multiple\nsearch fields with the same key, like `?related__search=foo&related__search=bar`,\nwill be ORed together. Terms separated by commas, like `?related__search=foo,bar`\nwill be ANDed together.\n\n## Filtering\n\nAny additional query string parameters may be used to filter the list of\nresults returned to those matching a given value.  Only fields and relations\nthat exist in the database may be used for filtering.  Any special characters\nin the specified value should be url-encoded. For example:\n\n    ?field=value%20xyz\n\nFields may also span relations, only for fields and relationships defined in\nthe database:\n\n    ?other__field=value\n\nTo exclude results matching certain criteria, prefix the field parameter with\n`not__`:\n\n    ?not__field=value\n\nBy default, all query string filters are AND'ed together, so\nonly the results matching *all* filters will be returned.  To combine results\nmatching *any* one of multiple criteria, prefix each query string parameter\nwith `or__`:\n\n    ?or__field=value&or__field=othervalue\n    ?or__not__field=value&or__field=othervalue\n\n(_Added in Ansible Tower 1.4.5_) The default AND filtering applies all filters\nsimultaneously to each related object being filtered across database\nrelationships.  The chain filter instead applies filters separately for each\nrelated object. To use, prefix the query string parameter with `chain__`:\n\n    ?chain__related__field=value&chain__related__field2=othervalue\n    ?chain__not__related__field=value&chain__related__field2=othervalue\n\nIf the first query above were written as\n`?related__field=value&related__field2=othervalue`, it would return only the\nprimary objects where the *same* related object satisfied both conditions.  As\nwritten using the chain filter, it would return the intersection of primary\nobjects matching each condition.\n\nField lookups may also be used for more advanced queries, by appending the\nlookup to the field name:\n\n    ?field__lookup=value\n\nThe following field lookups are supported:\n\n* `exact`: Exact match (default lookup if not specified).\n* `iexact`: Case-insensitive version of `exact`.\n* `contains`: Field contains value.\n* `icontains`: Case-insensitive version of `contains`.\n* `startswith`: Field starts with value.\n* `istartswith`: Case-insensitive version of `startswith`.\n* `endswith`: Field ends with value.\n* `iendswith`: Case-insensitive version of `endswith`.\n* `regex`: Field matches the given regular expression.\n* `iregex`: Case-insensitive version of `regex`.\n* `gt`: Greater than comparison.\n* `gte`: Greater than or equal to comparison.\n* `lt`: Less than comparison.\n* `lte`: Less than or equal to comparison.\n* `isnull`: Check whether the given field or related object is null; expects a\n  boolean value.\n* `in`: Check whether the given field's value is present in the list provided;\n  expects a list of items.\n\nBoolean values may be specified as `True` or `1` for true, `False` or `0` for\nfalse (both case-insensitive).\n\nNull values may be specified as `None` or `Null` (both case-insensitive),\nthough it is preferred to use the `isnull` lookup to explicitly check for null\nvalues.\n\nLists (for the `in` lookup) may be specified as a comma-separated list of\nvalues.\n\n(_Added in Ansible Tower 3.1.0_) Filtering based on the requesting user's\nlevel of access by query string parameter.\n\n* `role_level`: Level of role to filter on, such as `admin_role`\n\n\n\n\n# Create an Ad Hoc Command for an Inventory:\n\nMake a POST request to this resource with the following ad hoc command\nfields to create a new ad hoc command associated with this\ninventory.\n\n\n\n\n\n\n\n\n\n\n\n\n* `execution_environment`: The container image to be used for execution. (id, default=``)\n\n\n\n\n\n\n\n\n\n\n* `job_type`:  (choice)\n    - `run`: Run (default)\n    - `check`: Check\n\n* `limit`:  (string, default=`\"\"`)\n* `credential`:  (id, default=``)\n* `module_name`:  (choice)\n    - `command` (default)\n    - `shell`\n    - `yum`\n    - `apt`\n    - `apt_key`\n    - `apt_repository`\n    - `apt_rpm`\n    - `service`\n    - `group`\n    - `user`\n    - `mount`\n    - `ping`\n    - `selinux`\n    - `setup`\n    - `win_ping`\n    - `win_service`\n    - `win_updates`\n    - `win_group`\n    - `win_user`\n* `module_args`:  (string, default=`\"\"`)\n* `forks`:  (integer, default=`0`)\n* `verbosity`:  (choice)\n    - `0`: 0 (Normal) (default)\n    - `1`: 1 (Verbose)\n    - `2`: 2 (More Verbose)\n    - `3`: 3 (Debug)\n    - `4`: 4 (Connection Debug)\n    - `5`: 5 (WinRM Debug)\n* `extra_vars`:  (string, default=`\"\"`)\n* `become_enabled`:  (boolean, default=`False`)\n* `diff_mode`:  (boolean, default=`False`)",
  "renders": ["application/json", "text/html"],
  "parses": ["application/json"],
  "actions": {
    "POST": {
      "execution_environment": {
        "type": "id",
        "required": false,
        "label": "Execution environment",
        "help_text": "The container image to be used for execution.",
        "filterable": true
      },
      "job_type": {
        "type": "choice",
        "required": false,
        "label": "Job type",
        "filterable": true,
        "default": "run",
        "choices": [
          ["run", "Run"],
          ["check", "Check"]
        ]
      },
      "inventory": {
        "type": "id",
        "required": false,
        "label": "Inventory",
        "filterable": true
      },
      "limit": {
        "type": "string",
        "required": false,
        "label": "Limit",
        "filterable": true,
        "default": ""
      },
      "credential": {
        "type": "id",
        "required": false,
        "label": "Credential",
        "filterable": true
      },
      "module_name": {
        "type": "choice",
        "required": false,
        "label": "Module name",
        "filterable": true,
        "default": "command",
        "choices": [
          ["command", "command"],
          ["shell", "shell"],
          ["yum", "yum"],
          ["apt", "apt"],
          ["apt_key", "apt_key"],
          ["apt_repository", "apt_repository"],
          ["apt_rpm", "apt_rpm"],
          ["service", "service"],
          ["group", "group"],
          ["user", "user"],
          ["mount", "mount"],
          ["ping", "ping"],
          ["selinux", "selinux"],
          ["setup", "setup"],
          ["win_ping", "win_ping"],
          ["win_service", "win_service"],
          ["win_updates", "win_updates"],
          ["win_group", "win_group"],
          ["win_user", "win_user"]
        ]
      },
      "module_args": {
        "type": "string",
        "required": false,
        "label": "Module args",
        "filterable": true,
        "default": ""
      },
      "forks": {
        "type": "integer",
        "required": false,
        "label": "Forks",
        "min_value": 0,
        "max_value": 2147483647,
        "filterable": true,
        "default": 0
      },
      "verbosity": {
        "type": "choice",
        "required": false,
        "label": "Verbosity",
        "filterable": true,
        "default": 0,
        "choices": [
          [0, "0 (Normal)"],
          [1, "1 (Verbose)"],
          [2, "2 (More Verbose)"],
          [3, "3 (Debug)"],
          [4, "4 (Connection Debug)"],
          [5, "5 (WinRM Debug)"]
        ]
      },
      "extra_vars": {
        "type": "string",
        "required": false,
        "label": "Extra vars",
        "filterable": true,
        "default": ""
      },
      "become_enabled": {
        "type": "boolean",
        "required": false,
        "label": "Become enabled",
        "filterable": true,
        "default": false
      },
      "diff_mode": {
        "type": "boolean",
        "required": false,
        "label": "Diff mode",
        "filterable": true,
        "default": false
      }
    },
    "GET": {
      "id": {
        "type": "integer",
        "label": "ID",
        "help_text": "Database ID for this ad hoc command.",
        "filterable": true
      },
      "type": {
        "type": "choice",
        "label": "Type",
        "help_text": "Data type for this ad hoc command.",
        "filterable": true,
        "choices": [["ad_hoc_command", "Command"]]
      },
      "url": {
        "type": "string",
        "label": "Url",
        "help_text": "URL for this ad hoc command.",
        "filterable": false
      },
      "related": {
        "type": "object",
        "label": "Related",
        "help_text": "Data structure with URLs of related resources.",
        "filterable": false
      },
      "summary_fields": {
        "type": "object",
        "label": "Summary fields",
        "help_text": "Data structure with name/description for related resources.  The output for some objects may be limited for performance reasons.",
        "filterable": false
      },
      "created": {
        "type": "datetime",
        "label": "Created",
        "help_text": "Timestamp when this ad hoc command was created.",
        "filterable": true
      },
      "modified": {
        "type": "datetime",
        "label": "Modified",
        "help_text": "Timestamp when this ad hoc command was last modified.",
        "filterable": true
      },
      "name": {
        "type": "string",
        "label": "Name",
        "help_text": "Name of this ad hoc command.",
        "filterable": true
      },
      "launch_type": {
        "type": "choice",
        "label": "Launch type",
        "filterable": true,
        "choices": [
          ["manual", "Manual"],
          ["relaunch", "Relaunch"],
          ["callback", "Callback"],
          ["scheduled", "Scheduled"],
          ["dependency", "Dependency"],
          ["workflow", "Workflow"],
          ["webhook", "Webhook"],
          ["sync", "Sync"],
          ["scm", "SCM Update"]
        ]
      },
      "status": {
        "type": "choice",
        "label": "Status",
        "filterable": true,
        "choices": [
          ["new", "New"],
          ["pending", "Pending"],
          ["waiting", "Waiting"],
          ["running", "Running"],
          ["successful", "Successful"],
          ["failed", "Failed"],
          ["error", "Error"],
          ["canceled", "Canceled"]
        ]
      },
      "execution_environment": {
        "type": "id",
        "label": "Execution environment",
        "help_text": "The container image to be used for execution.",
        "filterable": true
      },
      "failed": {
        "type": "boolean",
        "label": "Failed",
        "filterable": true
      },
      "started": {
        "type": "datetime",
        "label": "Started",
        "help_text": "The date and time the job was queued for starting.",
        "filterable": true
      },
      "finished": {
        "type": "datetime",
        "label": "Finished",
        "help_text": "The date and time the job finished execution.",
        "filterable": true
      },
      "canceled_on": {
        "type": "datetime",
        "label": "Canceled on",
        "help_text": "The date and time when the cancel request was sent.",
        "filterable": true
      },
      "elapsed": {
        "type": "decimal",
        "label": "Elapsed",
        "help_text": "Elapsed time in seconds that the job ran.",
        "filterable": true
      },
      "job_explanation": {
        "type": "string",
        "label": "Job explanation",
        "help_text": "A status field to indicate the state of the job if it wasn't able to run and capture stdout",
        "filterable": true
      },
      "execution_node": {
        "type": "string",
        "label": "Execution node",
        "help_text": "The node the job executed on.",
        "filterable": true
      },
      "controller_node": {
        "type": "string",
        "label": "Controller node",
        "help_text": "The instance that managed the execution environment.",
        "filterable": true
      },
      "launched_by": {
        "type": "field",
        "label": "Launched by",
        "filterable": false
      },
      "work_unit_id": {
        "type": "string",
        "label": "Work unit id",
        "help_text": "The Receptor work unit ID associated with this job.",
        "filterable": true
      },
      "job_type": {
        "type": "choice",
        "label": "Job type",
        "filterable": true,
        "choices": [
          ["run", "Run"],
          ["check", "Check"]
        ]
      },
      "inventory": {
        "type": "id",
        "label": "Inventory",
        "filterable": true
      },
      "limit": {
        "type": "string",
        "label": "Limit",
        "filterable": true
      },
      "credential": {
        "type": "id",
        "label": "Credential",
        "filterable": true
      },
      "module_name": {
        "type": "choice",
        "label": "Module name",
        "filterable": true,
        "choices": [
          ["command", "command"],
          ["shell", "shell"],
          ["yum", "yum"],
          ["apt", "apt"],
          ["apt_key", "apt_key"],
          ["apt_repository", "apt_repository"],
          ["apt_rpm", "apt_rpm"],
          ["service", "service"],
          ["group", "group"],
          ["user", "user"],
          ["mount", "mount"],
          ["ping", "ping"],
          ["selinux", "selinux"],
          ["setup", "setup"],
          ["win_ping", "win_ping"],
          ["win_service", "win_service"],
          ["win_updates", "win_updates"],
          ["win_group", "win_group"],
          ["win_user", "win_user"]
        ]
      },
      "module_args": {
        "type": "string",
        "label": "Module args",
        "filterable": true
      },
      "forks": {
        "type": "integer",
        "label": "Forks",
        "min_value": 0,
        "max_value": 2147483647,
        "filterable": true
      },
      "verbosity": {
        "type": "choice",
        "label": "Verbosity",
        "filterable": true,
        "choices": [
          [0, "0 (Normal)"],
          [1, "1 (Verbose)"],
          [2, "2 (More Verbose)"],
          [3, "3 (Debug)"],
          [4, "4 (Connection Debug)"],
          [5, "5 (WinRM Debug)"]
        ]
      },
      "extra_vars": {
        "type": "string",
        "label": "Extra vars",
        "filterable": true
      },
      "become_enabled": {
        "type": "boolean",
        "label": "Become enabled",
        "filterable": true
      },
      "diff_mode": {
        "type": "boolean",
        "label": "Diff mode",
        "filterable": true
      }
    }
  },
  "types": ["ad_hoc_command"],
  "search_fields": ["description", "name"],
  "related_search_fields": [
    "hosts__search",
    "ad_hoc_command_events__search",
    "credentials__search",
    "labels__search",
    "execution_environment__search",
    "organization__search",
    "schedule__search",
    "dependent_jobs__search",
    "credential__search",
    "unifiedjob_blocked_jobs__search",
    "unifiedjob_ptr__search",
    "instance_group__search",
    "unified_job_node__search",
    "launch_config__search",
    "unified_job_template__search",
    "modified_by__search",
    "notifications__search",
    "inventory__search",
    "created_by__search"
  ],
  "max_page_size": 200
}
